workload_id	implementation	base_revision	system	backend	samples	model_fitting_variants	traits	model	missingness	bsize	threads	level0_s	level0_ridge_s	ridge_transfer_s	level1_s	output_s	total_s	pinned_downloads	pinned_download_bytes	loco_identity	final_stage2_status	notes
a100-n500k-m700k-p8-bt	path-Newton only	7ae2ddc	a2-highgpu-1g-a100-40gb	cuda	500000	700000	8	binary	0-10%	1000	12	310.281	232.417	90.431	157.339	9.274	482.626	0	0	control	Scientifically equivalent to original reference	Path-Newton control; five Level 0 and five Level 1 ridge parameters.
a100-n500k-m700k-p8-bt	pinned download trial A	7ae2ddc + working-tree optimization	a2-highgpu-1g-a100-40gb	cuda	500000	700000	8	binary	0-10%	1000	12	234.579	156.863	19.884	156.864	14.982	412.171	7110	114880000000	8/8 byte-identical to path-Newton control	Identical to previously validated path-Newton Stage 2 input	Pre-promotion trial; identical final code path with prototype environment gate.
a100-n500k-m700k-p8-bt	final default no-flags replay	7ae2ddc + working-tree optimization	a2-highgpu-1g-a100-40gb	cuda	500000	700000	8	binary	0-10%	1000	12	275.457	197.495	56.415	157.149	15.381	453.624	7110	114880000000	8/8 byte-identical to path-Newton control	Identical to previously validated path-Newton Stage 2 input	Final default implementation; no feature flags; records page-registration timing variance.
a100-n500k-m700k-p32-bt	path-Newton only	7ae2ddc	a2-highgpu-1g-a100-40gb	cuda	500000	700000	32	binary	0-10%	1000	12	981.171	901.874	363.493	614.276	53.676	1664.349	0	0	control	Scientifically equivalent to original reference	Path-Newton control; full 22.4-million-row Stage 2 A/B previously completed.
a100-n500k-m700k-p32-bt	default path-Newton + pinned download	7ae2ddc + working-tree optimization	a2-highgpu-1g-a100-40gb	cuda	500000	700000	32	binary	0-10%	1000	12	843.341	763.618	232.617	614.274	53.184	1526.362	7110	459520000000	32/32 byte-identical to path-Newton control	Identical to previously validated path-Newton Stage 2 input	Validated code path; promoted to unconditional default after the run.
